candidate_id,name,candidate_degree,technical_skills,soft_skills,projects,location_preference_1,location_preference_2,location_preference_3,social_category,sector_interest,past_participation,location_category
C0522,Rahul ChoudharyIII,B.Sc in Chemistry,"Research Skills, Analytical Techniques (GC), Analytical Techniques (HPLC), Lab Safety, Quality Control, Process Optimization","Collaboration, Critical Thinking, Communication, Time Management","Quality Report Preparation, GC Method Validation, P&ID Design Analysis",Baroda,Jamnagar,Chennai,OBC,Chemical Industry,No,urban
C1551,Ishaan,BCA,"JavaScript, Node.js, Python, TypeScript, Angular, Kubernetes","Critical Thinking, Collaboration, Communication, Creativity",Online Learning Platform,Mumbai,Chennai,Gurgaon,OBC,IT,Yes,urban
C0524,Yash Jain,B.Tech in Electrical Engineering,"Powertrain Electronics, Embedded Systems, PCB Design, Battery Technology, BMS (Battery Management Systems)","Adaptability, Problem-solving, Leadership","Battery Performance Testing, Thermal Management Study",Ahmedabad,Pune,Noida,GEN,Automotive,No,urban
C0525,Siddharth Verma,B.Tech in Process Engineering,"Safety Standards, Process Optimization, Polymer Testing, Lab Safety, Quality Control","Attention to Detail, Decision Making, Leadership","Safety Compliance Review, Material Balance Study, Spectroscopy Analysis",Jamnagar,Baroda,Hyderabad,SC,Chemical Industry,Yes,urban
C0526,Suresh Pillai,B.Tech in Biochemical Engineering,"Documentation, Quality Assurance, Quality Control, Process Optimization, P&ID Design","Critical Thinking, Adaptability, Creativity","Prototype Formulation, Material Testing Report",Jamnagar,Jaipur,Baroda,GEN,Chemical Industry,No,urban
C0527,Rohan Rastogi,B.Sc in Information Technology,"Flutter, Java, iOS, Swift, React Native, Redis, SQL, C++","Problem-Solving, Prioritization, Adaptability","API-Integrated News App, Library Management System",Hyderabad,Bangalore,Gurgaon,GEN,IT,No,urban
C0528,Ishaan,BCA,"JavaScript, MongoDB, Python, TypeScript, GraphQL","Leadership, Time Management, Adaptability, Problem Solving",Chat Application,Mumbai,Pune,Chennai,OBC,IT,No,urban
C0529,Sanya Kapoor,B.Sc in Statistics,"Data Visualization, PowerBI, Machine Learning, Python, EDA, NumPy, Web Development, Linux","Analytical Thinking, Collaboration, Problem-Solving, Leadership, Communication","PowerBI Dashboard, House Price Prediction, Customer Churn Prediction",Hyderabad,Gurgaon,Bangalore,GEN,IT,No,urban
C0530,Arjun Desai,B.Sc in Industrial Chemistry,"Safety Standards, Spectroscopy, Environmental Monitoring, Analytical Chemistry, Material Testing","Collaboration, Creativity, Adaptability","Energy Balance Optimization, Lab Equipment Calibration",Jamnagar,Chennai,Baroda,GEN,Chemical Industry,No,urban
C0531,Devansh Singh,B.Sc in Data Science,"Feature Engineering, Python, Data Visualization, EDA, Machine Learning, R, Java, Networking","Analytical Thinking, Critical Thinking, Problem-Solving, Communication, Leadership","Customer Churn Prediction, EDA on Retail Data, PowerBI Dashboard",Gurgaon,Bangalore,Hyderabad,OBC,IT,No,urban
C0532,Neha Sinha,B.Sc in Statistics,"Machine Learning, Data Visualization, Feature Engineering, Web Development, Docker, DevOps, TensorFlow","Collaboration, Analytical Thinking, Creativity","EDA on Retail Data, Predictive Sales Model",Hyderabad,Gurgaon,Bangalore,GEN,IT,No,urban
C0533,Vikram Kumar,B.E. in Mechanical Engineering,"BMS (Battery Management Systems), IoT, Signal Processing, Power Electronics, Energy Storage Systems","Problem-solving, Critical Thinking, Leadership","IoT Sensor Integration, Battery Performance Testing",Pune,Kolkata,Noida,GEN,Automotive,No,urban
C0534,Vikram JoshiJr.,B.Tech in Biochemical Engineering,"Research Skills, Laboratory Testing, Process Simulation, Material Testing, Process Optimization","Attention to Detail, Teamwork, Time Management","Prototype Formulation, P&ID Design Analysis",Baroda,Kolkata,Jamnagar,GEN,Chemical Industry,No,urban
C0535,Rohan,B.Tech IT,"JavaScript, React, HTML, Kubernetes, GraphQL, TypeScript","Communication, Teamwork, Leadership","Task Manager App, Chat Application",Hyderabad,Bangalore,Pune,SC,IT,Yes,urban
C0536,Kunal Chatterjee,B.Sc in Mechanical Engineering,"3D Modeling, Vehicle Testing, Vehicle Dynamics, Battery Technology, Battery Management","Leadership, Critical thinking, Adaptability",Material Strength Analysis,Noida,Ahmedabad,Pune,GEN,Automotive,No,urban
C0537,Aman Chopra,B.Tech in Electronics,"Kali Linux, SIEM Tools, Bash Scripting, Linux, CSS","Attention to Detail, Problem-Solving, Creativity","Firewall Implementation, Data Encryption Tool, Blog Application",Hyderabad,Bangalore,Gurgaon,GEN,IT,Yes,urban
C0538,Pooja Das,B.Com in Accounting,"Compliance Monitoring, Legal Drafting, Data Analysis, Tax Compliance, Financial Modeling","Critical Thinking, Ethical Judgment, Time Management","Compliance Audit Report, Financial Data Analysis",Mumbai,Hyderabad,Chennai,GEN,Banking & Financial Services,Yes,urban
C0539,Kunal Solanki,B.Com in Finance,"Treasury Reporting, Cash Flow Analysis, Client Documentation, Financial Modeling, Excel, Treasury Operations Basics, Banking Regulations (Basics), Market Research","Attention to Detail, Collaboration, Communication","Client Onboarding Documentation, Market Trend Analysis, FX Research Summary, Corporate Client Presentation",Mumbai,Hyderabad,Bangalore,GEN,Banking & Financial Services,No,rural
C0540,Harsh Rastogi,BBA in Finance,"Banking Regulations (Basics), Treasury Reporting, Financial Modeling, Client Documentation, Data Analysis","Communication, Collaboration, Leadership","Treasury Report Preparation, Corporate Client Presentation",Mumbai,Hyderabad,Ahmedabad,GEN,Banking & Financial Services,No,urban
C0541,Priya Mehta,B.Tech in Artificial Intelligence,"Data Visualization, PowerBI, Machine Learning, EDA, Feature Engineering, Linux, Pandas, SQL","Critical Thinking, Analytical Thinking, Collaboration, Adaptability","House Price Prediction, Customer Churn Prediction, Fraud Detection Model",Hyderabad,Bangalore,Gurgaon,OBC,IT,No,rural
C0542,Rohan Mehta,B.Sc in Industrial Chemistry,"Heat & Mass Transfer, Process Simulation (Aspen HYSYS), Chemical Engineering Fundamentals, P&ID Design, Analytical Chemistry, Environmental Monitoring","Collaboration, Problem-Solving, Teamwork","Material Balance Study, Process Simulation Study, Safety Compliance Review",Jamnagar,Baroda,Jaipur,GEN,Chemical Industry,Yes,urban
C0543,Ananya Mishra,B.Sc in Mechanical Engineering,"SolidWorks, Material Science, Finite Element Analysis, CAD (AutoCAD), Vehicle Testing, Manufacturing Processes","Problem-solving, Teamwork, Leadership","CAD Suspension Design, Material Strength Analysis, 3D Component Modeling",Noida,Chennai,Pune,GEN,Automotive,Yes,rural
C0544,Simran Gupta,B.Com in Accounting,"Legal Drafting, Risk & Compliance Knowledge, Audit Procedures, Regulatory Frameworks (RBI/SEBI), Financial Analysis, Financial Modeling","Critical Thinking, Attention to Detail, Adaptability","Risk Assessment Study, Compliance Audit Report",Mumbai,Ahmedabad,Hyderabad,SC,Banking & Financial Services,No,urban
C0545,Amit SharmaIII,B.Sc in Biotechnology,"Analytical Techniques (GC), Documentation, Analytical Techniques (HPLC), Chemical Analysis, Material Testing, Process Optimization","Attention to Detail, Collaboration, Communication, Creativity","Formulation Testing, Quality Report Preparation, Chemical Synthesis Trial",Jamnagar,Baroda,Chennai,GEN,Chemical Industry,No,rural
C0546,Meera Joshi,B.Sc in Chemistry,"Chemical Engineering Fundamentals, Process Simulation (ChemCAD), Quality Control, Spectroscopy, Material Testing","Collaboration, Leadership, Creativity","Heat Exchanger Design, Process Simulation Study, Chemical Sample Testing",Ahmedabad,Baroda,Jamnagar,OBC,Chemical Industry,No,rural
C0547,Tarun Das,BBA in Business Administration,"Treasury Reporting, Banking Regulations (Basics), Client Documentation, Data Analysis, Banking Operations","Attention to Detail, Communication, Time Management","Treasury Cash Flow Report, Treasury Report Preparation, Financial Data Cleaning",Hyderabad,Mumbai,Kolkata,GEN,Banking & Financial Services,No,urban
C0548,Siddharth Reddy,B.A in Economics,"Dart, iOS, REST APIs, Android, React Native","Collaboration, Prioritization, Teamwork, Decision Making, Attention to Detail","Real-time Location App, Firebase Auth Demo",Bangalore,Hyderabad,Gurgaon,GEN,IT,No,urban
C0549,Rohan Kumar,B.Com in Accounting,"Financial Statement Analysis, Tax Compliance, Interest Rate Analytics, Portfolio Management, Banking Operations","Attention to Detail, Leadership, Time Management","Corporate Client Presentation, Financial Data Cleaning",Ahmedabad,Hyderabad,Mumbai,GEN,Banking & Financial Services,No,rural
C0550,Priya Mehta,B.Tech in Information Technology,"Feature Engineering, Linux, NumPy, Cybersecurity, SQL","Problem-Solving, Critical Thinking, Teamwork, Analytical Thinking, Communication",Fraud Detection Model,Bangalore,Gurgaon,Hyderabad,GEN,IT,No,urban
C0551,Meera Das,B.A. in Economics,"Legal Drafting, Excel, Risk & Compliance Knowledge, Audit Procedures, Tax Compliance, Data Analysis","Communication, Critical Thinking, Ethical Judgment","Audit Compliance Report, Compliance Audit Report",Ahmedabad,Hyderabad,Mumbai,EWS,Banking & Financial Services,No,urban
C0552,Suresh Pillai,B.Tech in Chemical Engineering,"Analytical Techniques (GC), Quality Assurance, Process Optimization, P&ID Design, Process Safety","Critical Thinking, Teamwork, Creativity","Lab Experimentation, Chemical Synthesis Trial",Jamnagar,Mumbai,Baroda,GEN,Chemical Industry,No,urban
C0553,Rohan Sharma,B.Sc in Information Technology,"Android, Java, Dart, Machine Learning, C++","Collaboration, Empathy, Leadership","API-Integrated News App, Firebase Auth Demo",Gurgaon,Hyderabad,Bangalore,GEN,IT,Yes,urban
C0554,Rekha Verma,B.Sc in Economics,"Banking Regulations (Basics), Tax Compliance, Portfolio Management, Investment Analysis, Data Analysis","Critical Thinking, Leadership, Ethical Judgment","Treasury Report Preparation, Tax Compliance Report",Nagpur,Mumbai,Hyderabad,GEN,Banking & Financial Services,No,urban
C0555,Ishita Patel,B.Sc in Industrial Chemistry,"Process Simulation (ChemCAD), Polymer Testing, Analytical Chemistry, Environmental Monitoring, Spectroscopy","Problem-Solving, Decision Making, Adaptability","Energy Balance Optimization, Spectroscopy Analysis",Baroda,Jaipur,Jamnagar,OBC,Chemical Industry,No,urban
C0556,Vikram Aggarwal,B.Com in Finance,"Risk Assessment, Client Documentation, Cash Flow Analysis, Treasury Operations Basics, Data Analysis","Collaboration, Critical Thinking, Time Management","Treasury Cash Flow Report, FX Research Summary",Mumbai,Hyderabad,Kolkata,OBC,Banking & Financial Services,No,rural
C0557,Shivani Kohli,B.Com in Finance,"Excel, Data Analysis, Investment Analysis, Portfolio Management, Banking Operations","Leadership, Adaptability, Ethical Judgment","Banking Ops Mapping, Client Onboarding Documentation",Nagpur,Hyderabad,Mumbai,GEN,Banking & Financial Services,No,urban
C0558,Rekha Singh,B.Com in Finance,"Treasury Reporting, Treasury Operations Basics, Financial Modeling, Banking Operations, Tax Compliance","Attention to Detail, Communication, Adaptability","Market Trend Analysis, Corporate Client Presentation",Kolkata,Hyderabad,Mumbai,OBC,Banking & Financial Services,No,urban
C0559,Sai Kohli,B.Tech in Information Technology,"Penetration Testing, Firewall Configuration, Linux, Network Security, Data Structures","Critical Thinking, Problem-Solving, Time Management","Log Monitoring Dashboard, Penetration Testing Script, Weather Forecasting App",Bangalore,Gurgaon,Hyderabad,GEN,IT,No,urban
C0560,Rajeev Kulkarni,B.Tech in Mechanical Engineering,"SolidWorks, Mechanical Design, Finite Element Analysis, CATIA, 3D Modeling, Manufacturing Processes, Battery Technology, Battery Management","Collaboration, Attention to detail, Teamwork, Adaptability","Prototype Testing, Material Strength Analysis, 3D Component Modeling",Pune,Noida,Chennai,OBC,Automotive,Yes,urban
C0561,Vihaan,MCA,"MongoDB, Node.js, React, Python, Kubernetes","Adaptability, Problem Solving, Critical Thinking","Blog Platform, Portfolio Website",Gurgaon,Mumbai,Chennai,ST,IT,No,rural
C0562,Aditya Nair,B.Tech in Chemical Engineering,"P&ID Design, Safety Standards, Lab Safety, Material Testing, Analytical Chemistry","Attention to Detail, Adaptability, Critical Thinking","Process Simulation Study, Process Flow Optimization, Material Quality Audit",Jamnagar,Baroda,Jaipur,GEN,Chemical Industry,No,urban
C0563,Aarav Chauhan,BBA in Finance,"Excel, Risk Assessment, Financial Analysis, Tax Compliance, Financial Modeling","Critical Thinking, Adaptability, Ethical Judgment",Tax Compliance Report,Hyderabad,Bangalore,Mumbai,GEN,Banking & Financial Services,Yes,urban
C0564,Ritika Rastogi,B.Tech in Computer Science,"Firewall Configuration, IDS/IPS, Machine Learning, C++, Artificial Intelligence, JavaScript","Attention to Detail, Adaptability, Collaboration","Penetration Testing Script, E-commerce Website",Gurgaon,Hyderabad,Bangalore,GEN,IT,No,rural
C0565,Kunal Chatterjee,B.Tech in Mechanical Engineering,"Prototyping, Vehicle Testing, Vehicle Dynamics, Manufacturing Processes, Battery Technology, Battery Management","Collaboration, Attention to detail, Teamwork",3D Component Modeling,Pune,Chennai,Noida,ST,Automotive,No,rural
C0566,Karan Bhatia,B.Tech in Process Engineering,"Process Simulation (ChemCAD), Chemical Engineering Fundamentals, Process Optimization, Excel, Safety Standards, Heat & Mass Transfer, Lab Safety","Problem-Solving, Attention to Detail, Collaboration, Critical Thinking","Material Balance Study, Process Simulation Study, Safety Compliance Review",Chennai,Baroda,Jamnagar,GEN,Chemical Industry,No,urban
C0567,Gaurav Chauhan,B.Com in Banking,"Excel, Investment Analysis, Portfolio Management, Interest Rate Analytics, Tax Compliance","Leadership, Time Management, Adaptability","Banking Ops Mapping, Corporate Client Presentation",Mumbai,Kolkata,Hyderabad,EWS,Banking & Financial Services,No,urban
C0568,Priya Kumar,B.Sc in Economics,"Legal Drafting, Excel, Risk & Compliance Knowledge, Documentation, Financial Analysis, Risk Assessment","Critical Thinking, Attention to Detail, Adaptability","Documentation Review, Risk Assessment Study",Mumbai,Hyderabad,Chennai,GEN,Banking & Financial Services,No,urban
C0569,Simran Kapoor,B.Sc in Industrial Chemistry,"Safety Standards, Environmental Monitoring, Spectroscopy, Lab Safety, Analytical Chemistry","Collaboration, Teamwork, Time Management","Energy Balance Optimization, Lab Equipment Calibration",Ahmedabad,Baroda,Jamnagar,GEN,Chemical Industry,No,urban
C1838,Saanvi,B.Tech CSE,"CSS, HTML, GraphQL, Java, Kubernetes, Docker, Angular","Teamwork, Adaptability, Collaboration, Leadership",Job Portal,Chennai,Gurgaon,Bangalore,SC,IT,No,urban
C0570,Neha Patel,B.A. in Economics,"Compliance Monitoring, Excel, Tax Compliance, Financial Analysis, Risk Assessment","Critical Thinking, Adaptability, Time Management","Regulatory Summary, Market Analysis Report",Bangalore,Hyderabad,Mumbai,EWS,Banking & Financial Services,No,urban
C0571,Diya,MCA,"MongoDB, CSS, Python, Docker, Java, Kubernetes, SQL","Leadership, Adaptability, Communication",Portfolio Website,Hyderabad,Gurgaon,Mumbai,ST,IT,Yes,urban
C0572,Simran Choudhary,B.Tech in Computer Science,"Java, iOS, Android, Git, Swift, React Native, SQL","Problem-Solving, Adaptability, Collaboration","Real-time Location App, Media Streaming App, Firebase Auth Demo",Bangalore,Gurgaon,Hyderabad,SC,IT,No,rural
C0573,Vihaan,B.Tech IT,"HTML, CSS, Node.js, Kubernetes, Angular","Communication, Teamwork, Critical Thinking","Blog Platform, Social Media Clone",Gurgaon,Chennai,Pune,General,IT,No,rural
C0574,Lakshmi Chopra,B.Tech in Information Technology,"Cloud Security, Linux, Bash Scripting, Firewall Configuration, Penetration Testing, Ethical Hacking, SQL, C++","Problem-Solving, Attention to Detail, Critical Thinking, Creativity","Penetration Testing Script, Firewall Implementation, Network Vulnerability Scanner, Data Encryption Tool",Hyderabad,Gurgaon,Bangalore,OBC,IT,No,urban
C0575,Rohan GuptaII,B.Sc in Biotechnology,"Documentation, Lab Safety, Process Simulation, Material Testing, Chemical Synthesis","Collaboration, Communication, Adaptability","Quality Report Preparation, P&ID Design Analysis",Chennai,Baroda,Jamnagar,GEN,Chemical Industry,No,urban
C0576,Meera,MCA,"JavaScript, CSS, HTML, MongoDB, Node.js, Vue.js, GraphQL, Docker","Communication, Teamwork, Adaptability, Time Management, Critical Thinking","E-commerce Website, Task Manager App, Blog Platform, Job Portal",Chennai,Hyderabad,Pune,SC,IT,Yes,urban
C0577,Priya Mehta,B.Com,"Kotlin, Flutter, XML, iOS, SQLite, C++, GCP, CSS, Machine Learning","Adaptability, Communication, Time Management","Fitness Tracker App, Library Management System",Gurgaon,Hyderabad,Bangalore,GEN,IT,No,urban
C0578,Harsh Shah,B.Tech in Mechanical Engineering,"Power Electronics, BMS (Battery Management Systems), MATLAB/Simulink, Powertrain Electronics, Signal Processing","Problem-solving, Collaboration, Time Management","IoT Sensor Integration, EV Range Optimization, CAD Component Modeling",Noida,Hyderabad,Pune,OBC,Automotive,Yes,rural
C0579,Neha Kulkarni,B.Tech in Biochemical Engineering,"Quality Assurance, Research Skills, Lab Safety, Analytical Techniques (GC), Chemical Synthesis, Process Optimization","Attention to Detail, Collaboration, Leadership, Time Management","Quality Report Preparation, Spectroscopy Study, P&ID Design Analysis",Jamnagar,Ahmedabad,Baroda,GEN,Chemical Industry,No,rural
C0580,Neha Gupta,B.E. in Industrial Design,"Material Science, Design Optimization, CATIA, Vehicle Testing, Battery Technology, Battery Management","Collaboration, Attention to detail, Time management, Adaptability","3D Component Modeling, CAD Suspension Design, Design Optimization Study",Pune,Mumbai,Noida,EWS,Automotive,Yes,urban
C0581,Lakshmi Das,B.Sc in Information Technology,"Penetration Testing, Linux, IDS/IPS, Wireshark, Ethical Hacking, Cloud Security, Data Structures","Attention to Detail, Problem-Solving, Critical Thinking, Creativity","Network Vulnerability Scanner, Penetration Testing Script, Firewall Implementation, SIEM Alert Analyzer",Bangalore,Gurgaon,Hyderabad,GEN,IT,No,urban
C0582,Kunal Chatterjee,B.E. in Industrial Design,"SolidWorks, 3D Modeling, Vehicle Dynamics, Manufacturing Processes, Embedded Systems, Battery Technology, Battery Management","Collaboration, Attention to detail, Leadership, Critical thinking","Material Strength Analysis, Vehicle Testing Module",Hyderabad,Noida,Pune,GEN,Automotive,No,urban
C0583,Rhea Chopra,B.A. in Economics,"Treasury Reporting, Market Research, Tax Compliance, Portfolio Management, Interest Rate Analytics","Critical Thinking, Time Management, Leadership","FX Research Summary, Financial Data Cleaning",Hyderabad,Jaipur,Mumbai,OBC,Banking & Financial Services,Yes,urban
C0584,Aman Khan,B.Tech in Mechanical Engineering,"SolidWorks, Material Science, CATIA, Vehicle Dynamics, Manufacturing Processes, Battery Technology","Problem-solving, Time management, Teamwork, Creativity","3D Component Modeling, CAD Suspension Design",Noida,Pune,Kolkata,GEN,Automotive,No,urban
C0585,Mitali Iyer,BBA in Finance,"Market Research, Banking Regulations (Basics), Interest Rate Analytics, Portfolio Management, Investment Analysis","Communication, Adaptability, Time Management","FX Research Summary, Financial Data Cleaning",Jaipur,Hyderabad,Mumbai,GEN,Banking & Financial Services,No,urban
C0586,Prateek Rastogi,B.Com in Accounting,"Treasury Operations Basics, Interest Rate Analytics, Tax Compliance, Banking Operations, Data Analysis","Collaboration, Adaptability, Time Management","Banking Ops Mapping, Financial Data Cleaning",Mumbai,Jaipur,Hyderabad,SC,Banking & Financial Services,No,urban
C0587,Ishita Patel,B.Sc in Industrial Chemistry,"Safety Standards, Excel, Polymer Testing, Quality Control, Lab Safety","Problem-Solving, Teamwork, Critical Thinking","Energy Balance Optimization, Heat Exchanger Design, Lab Equipment Calibration",Baroda,Jamnagar,Ahmedabad,GEN,Chemical Industry,No,urban
C0588,Vihaan,MCA,"MongoDB, React, JavaScript, HTML, Node.js, TypeScript, Angular, Kubernetes, Next.js","Teamwork, Communication, Adaptability, Leadership, Creativity","Blog Platform, Task Manager App, E-commerce Website, Job Portal",Chennai,Pune,Bangalore,SC,IT,No,rural
C0589,Kavya Mishra,B.Sc in Engineering (Electrical),"Signal Processing, BMS (Battery Management Systems), CAN Bus, Sensor Integration, Energy Storage Systems","Leadership, Creativity, Communication","IoT Sensor Integration, Chassis Design Analysis",Pune,Noida,Mumbai,EWS,Automotive,No,urban
C0590,Neha Kulkarni,B.E. in Chemical Engineering,"Process Simulation (Aspen HYSYS), Process Simulation (ChemCAD), Heat & Mass Transfer, Safety Standards, Quality Control, Analytical Chemistry","Problem-Solving, Collaboration, Teamwork","Heat Exchanger Design, Process Simulation Study, Process Flow Optimization",Jamnagar,Baroda,Chennai,GEN,Chemical Industry,No,rural
C0591,Aarav Sharma,B.Sc in Mechanical Engineering,"SolidWorks, Prototyping, Mechanical Design, Material Science, Finite Element Analysis, Design Optimization, CATIA, CAD (AutoCAD), 3D Modeling, Battery Technology","Collaboration, Attention to detail, Critical thinking, Creativity","3D Component Modeling, Design Optimization Study, Material Strength Analysis, CAD Suspension Design",Bangalore,Pune,Noida,GEN,Automotive,Yes,rural
C0592,Priya Gupta,B.Tech in Software Engineering,"Flutter, Java, REST APIs, JavaScript, Machine Learning","Communication, Time Management, Organization","Media Streaming App, Cross-Platform Chat App",Hyderabad,Bangalore,Gurgaon,GEN,IT,No,urban
C0593,Priya Mehta,B.Sc in Information Technology,"Wireshark, IDS/IPS, SQL, Computer Networks, Data Structures","Critical Thinking, Creativity, Leadership","SIEM Alert Analyzer, Library Management System",Hyderabad,Bangalore,Gurgaon,SC,IT,No,urban
C0594,Isha Verma,B.Tech in Information Technology,"iOS, Firebase, Kotlin, TypeScript, Redis","Adaptability, Time Management, Critical Thinking","Fitness Tracker App, Cross-Platform Chat App",Bangalore,Gurgaon,Hyderabad,OBC,IT,Yes,urban
C0595,Manish Yadav,B.E. in Chemical Engineering,"P&ID Design, Safety Standards, Excel, Process Optimization, Polymer Testing, Environmental Monitoring","Collaboration, Problem-Solving, Decision Making","Energy Balance Optimization, Heat Exchanger Design, Process Flow Optimization",Jamnagar,Jaipur,Baroda,GEN,Chemical Industry,No,rural
C0596,Arjun Pillai,B.Tech in Artificial Intelligence,"Data Visualization, EDA, PowerBI, Web Development, Hadoop, Docker, Pandas","Collaboration, Critical Thinking, Teamwork","Fraud Detection Model, Predictive Sales Model",Bangalore,Gurgaon,Hyderabad,GEN,IT,Yes,urban
C0597,Aditya Nair,B.Tech in Automotive Engineering,"Finite Element Analysis, CATIA, Vehicle Testing, Manufacturing Processes, Battery Management","Collaboration, Time management, Teamwork, Adaptability","Material Strength Analysis, Battery Performance Analysis",Bangalore,Pune,Noida,GEN,Automotive,No,urban
C0598,Ananya Ghosh,B.Sc in Industrial Chemistry,"Chemical Engineering Fundamentals, Analytical Chemistry, Environmental Monitoring, Polymer Testing, Material Testing","Collaboration, Adaptability, Decision Making","Safety Compliance Review, Lab Equipment Calibration",Baroda,Jamnagar,Ahmedabad,SC,Chemical Industry,No,rural
C0599,Priya Patel,B.Com in Accounting,"Client Documentation, Data Analysis, Banking Operations, Tax Compliance, Investment Analysis","Communication, Leadership, Ethical Judgment","Financial Data Cleaning, Tax Compliance Report",Mumbai,Kolkata,Hyderabad,GEN,Banking & Financial Services,No,urban
C0600,Kavya Reddy,B.Tech in Automotive Engineering,"Prototyping, Material Science, Finite Element Analysis, CATIA, CAD (AutoCAD), Vehicle Testing, Embedded Systems, Battery Technology","Collaboration, Leadership, Critical thinking, Creativity","3D Component Modeling, Material Strength Analysis, Prototype Testing",Pune,Noida,Hyderabad,GEN,Automotive,No,urban
C0601,Sneha Kulkarni,B.Tech in Computer Science,"Python, Feature Engineering, EDA, Machine Learning, Data Visualization, Pandas, Hadoop","Analytical Thinking, Critical Thinking, Problem-Solving, Creativity, Adaptability","Predictive Sales Model, Customer Churn Prediction, EDA on Retail Data",Hyderabad,Gurgaon,Bangalore,SC,IT,No,urban
C0602,Rohan GuptaIII,B.Sc in Industrial Chemistry,"Problem-Solving, Lab Safety, Research Skills, Laboratory Testing, Process Simulation, Material Testing","Collaboration, Attention to Detail, Adaptability, Leadership","Quality Report Preparation, Spectroscopy Study, Chemical Synthesis Trial",Baroda,Jamnagar,Jaipur,SC,Chemical Industry,No,urban
C0603,Arjun Joshi,B.A. in Economics,"Audit Procedures, Excel, Tax Compliance, Banking Operations, Data Analysis","Collaboration, Time Management, Ethical Judgment","Audit Compliance Report, Financial Data Analysis",Hyderabad,Mumbai,Chennai,GEN,Banking & Financial Services,No,urban
C0604,Kabir,B.Tech CSE,"React, Node.js, Java, Kubernetes, Vue.js, SQL","Time Management, Adaptability, Collaboration, Communication",Job Portal,Gurgaon,Mumbai,Bangalore,SC,IT,Yes,rural
C0605,Milan Solanki,B.A. in Economics,"Risk Assessment, Portfolio Management, Investment Analysis, Data Analysis, Interest Rate Analytics","Attention to Detail, Leadership, Adaptability","FX Research Summary, Banking Ops Mapping",Mumbai,Hyderabad,Nagpur,GEN,Banking & Financial Services,No,urban
C0606,Meera Singh,B.Sc in Engineering (Electrical),"Embedded Systems, Manufacturing Processes, Sensor Integration, Thermal Management, Chassis Design","Time Management, Creativity, Teamwork","Power Electronics Simulation, Manufacturing Workflow Study",Chennai,Noida,Pune,GEN,Automotive,No,urban
