candidate_id,name,candidate_degree,technical_skills,soft_skills,projects,location_preference_1,location_preference_2,location_preference_3,social_category,sector_interest,past_participation,location_category
C1662,Simran KaurJr.,B.Tech in Biochemical Engineering,"Analytical Techniques (GC), Research Skills, Chemical Synthesis, Process Optimization, Process Simulation","Critical Thinking, Leadership, Creativity","Quality Report Preparation, Process Flow Optimization",Chennai,Baroda,Jamnagar,SC,Chemical Industry,No,urban
C1663,Ananya Iyer,B.Sc in Statistics,"Feature Engineering, Data Visualization, Web Development, NumPy, DevOps, Cybersecurity","Critical Thinking, Teamwork, Communication, Creativity","House Price Prediction, Blog Website",Gurgaon,Hyderabad,Bangalore,OBC,IT,No,urban
C1664,Pooja Ghosh,B.Tech in Computer Science,"Flutter, iOS, Android, REST APIs, CSS","Problem-Solving, Time Management, Teamwork","Real-time Location App, Cross-Platform Chat App",Gurgaon,Bangalore,Hyderabad,GEN,IT,No,rural
C1665,Sanya Kapoor,B.Sc in Data Science,"Data Visualization, Machine Learning, EDA, Cloud, Docker","Collaboration, Problem-Solving, Creativity","PowerBI Dashboard, EDA on Retail Data",Bangalore,Gurgaon,Hyderabad,GEN,IT,No,urban
C1666,Simran Kaur,B.Sc in Industrial Chemistry,"Quality Assurance, Lab Safety, Material Testing, Chemical Synthesis, P&ID Design","Attention to Detail, Communication, Leadership","Spectroscopy Study, P&ID Design Analysis",Kolkata,Baroda,Jamnagar,GEN,Chemical Industry,No,urban
C1667,Shivam Bhatia,B.Sc in Computer Science,"SQLite, Git, React Native, Java, Swift, XML, C++","Time Management, Adaptability, Problem-Solving","Fitness Tracker App, E-commerce Mobile App, Real-time Location App",Hyderabad,Gurgaon,Bangalore,GEN,IT,No,rural
C1668,Pallavi Rastogi,B.A in Economics,"Cryptography, Bash Scripting, SQL, Machine Learning, CSS, PHP, HTML","Critical Thinking, Leadership, Work Ethic","Data Encryption Tool, Blog Application",Bangalore,Hyderabad,Gurgaon,OBC,IT,No,rural
C1669,Aman Lal,B.Tech in Mechanical Engineering,"PCB Design, Power Electronics, Energy Storage Systems, CAN Bus, Manufacturing Processes","Critical Thinking, Leadership, Teamwork","Thermal Management Study, Chassis Design Analysis",Noida,Pune,Jaipur,GEN,Automotive,No,urban
C1670,Arjun Pillai,B.Tech in Computer Science,"Machine Learning, Python, EDA, Linux, TensorFlow","Problem-Solving, Critical Thinking, Teamwork","House Price Prediction, EDA on Retail Data",Gurgaon,Bangalore,Hyderabad,OBC,IT,No,urban
C1671,Simran Kapoor,B.Tech in Process Engineering,"Heat & Mass Transfer, Excel, Process Simulation (ChemCAD), P&ID Design, Quality Control, Environmental Monitoring","Attention to Detail, Collaboration, Creativity","Process Simulation Study, Heat Exchanger Design, Process Flow Optimization",Jamnagar,Baroda,Hyderabad,OBC,Chemical Industry,No,urban
C1672,Manish Kumar,B.A. in Economics,"Audit Procedures, Risk & Compliance Knowledge, Compliance Monitoring, Legal Drafting, Data Analysis, Banking Operations","Communication, Critical Thinking, Time Management","Documentation Review, Audit Compliance Report",Mumbai,Hyderabad,Ahmedabad,OBC,Banking & Financial Services,No,urban
C1673,Aman Khan,B.Tech in Automotive Engineering,"SolidWorks, Prototyping, Mechanical Design, Material Science, Finite Element Analysis, Design Optimization, CATIA, CAD (AutoCAD), Embedded Systems, Battery Management","Collaboration, Attention to detail, Teamwork","CAD Suspension Design, Material Strength Analysis, 3D Component Modeling",Mumbai,Pune,Noida,GEN,Automotive,No,urban
C1674,Kunal Kapoor,B.Tech in Electrical Engineering,"MATLAB/Simulink, Battery Technology, Embedded Systems, Power Electronics, Control Systems, Signal Processing","Adaptability, Attention to Detail, Collaboration","BMS Development, Thermal Management Study, EV Range Optimization, Battery Performance Testing",Pune,Noida,Chennai,GEN,Automotive,No,rural
C1675,Rohan Sharma,B.Com in Accounting,"Excel, Audit Procedures, Risk & Compliance Knowledge, Documentation, Financial Modeling, Banking Operations","Critical Thinking, Collaboration, Adaptability","Risk Assessment Study, Compliance Audit Report",Mumbai,Ahmedabad,Hyderabad,GEN,Banking & Financial Services,No,urban
C1676,Ananya Iyer,B.Tech in Artificial Intelligence,"PowerBI, Feature Engineering, Python, Hadoop, Docker, Web Development","Problem-Solving, Analytical Thinking, Communication","PowerBI Dashboard, House Price Prediction",Gurgaon,Hyderabad,Bangalore,GEN,IT,No,urban
C1677,Kavya Nair,BBA in Business Administration,"Excel, Risk & Compliance Knowledge, Audit Procedures, Regulatory Frameworks (RBI/SEBI), Data Analysis, Tax Compliance","Attention to Detail, Communication, Ethical Judgment","Risk Assessment Study, Regulatory Summary",Ahmedabad,Mumbai,Hyderabad,GEN,Banking & Financial Services,No,urban
C1678,Vikram Chauhan,B.Com in Finance,"Excel, Legal Drafting, Compliance Monitoring, Risk & Compliance Knowledge, Regulatory Frameworks (RBI/SEBI), Banking Operations","Attention to Detail, Communication, Critical Thinking","Compliance Audit Report, Regulatory Summary, Documentation Review",Mumbai,Bangalore,Hyderabad,ST,Banking & Financial Services,No,urban
C1679,Saanvi,BCA,"CSS, MongoDB, React, TypeScript, Python","Teamwork, Adaptability, Leadership","Task Manager App, Social Media Clone",Gurgaon,Pune,Mumbai,OBC,IT,Yes,urban
C1680,Vikram Rao,B.Tech in Automotive Engineering,"SolidWorks, Prototyping, Material Science, CATIA, Vehicle Testing, Embedded Systems, Battery Technology, Battery Management","Collaboration, Attention to detail, Creativity","Prototype Testing, Material Strength Analysis, CAD Suspension Design",Noida,Pune,Ahmedabad,EWS,Automotive,No,rural
C1681,Anusha Mehta,B.E. in Mechanical Engineering,"IoT, Power Electronics, PCB Design, BMS (Battery Management Systems), Embedded Systems","Critical Thinking, Time Management, Communication","Battery Performance Testing, Thermal Management Study",Noida,Pune,Mumbai,GEN,Automotive,No,urban
C1682,Varun Malhotra,B.E. in Petroleum Engineering,"Process Optimization, Heat & Mass Transfer, Process Simulation (ChemCAD), Process Simulation (Aspen HYSYS), Safety Standards, P&ID Design, Quality Control","Problem-Solving, Attention to Detail, Collaboration, Critical Thinking","Material Balance Study, Heat Exchanger Design, Safety Compliance Review",Mumbai,Baroda,Jamnagar,GEN,Chemical Industry,No,urban
C1683,Tanya Jain,BBA in Business Administration,"Client Documentation, Interest Rate Analytics, Investment Analysis, Data Analysis, Tax Compliance","Collaboration, Adaptability, Leadership","FX Research Summary, Banking Ops Mapping",Mumbai,Chennai,Hyderabad,GEN,Banking & Financial Services,Yes,urban
C1684,Sahil Khan,B.Sc in Industrial Chemistry,"Analytical Techniques (HPLC), Quality Control, Process Simulation, Chemical Synthesis, Material Testing","Attention to Detail, Time Management, Communication","Chemical Synthesis Trial, Material Testing Report",Jamnagar,Baroda,Jaipur,OBC,Chemical Industry,No,urban
C1685,Harsh Ahuja,B.Sc in Information Technology,"Bash Scripting, Ethical Hacking, IDS/IPS, Wireshark, C++, HTML","Critical Thinking, Attention to Detail, Decision Making","Log Monitoring Dashboard, Network Vulnerability Scanner, Hospital Management System",Hyderabad,Gurgaon,Bangalore,GEN,IT,No,urban
C1686,Amit SharmaIII,B.Tech in Chemical Engineering,"Quality Assurance, Problem-Solving, Chemical Analysis, Research Skills, Process Simulation, Chemical Synthesis","Critical Thinking, Attention to Detail, Communication, Creativity","HPLC Analysis, Spectroscopy Study, Material Testing Report",Jamnagar,Baroda,Jaipur,GEN,Chemical Industry,No,urban
C1687,Pallavi Chopra,B.Com,"Flutter, Java, Kotlin, AWS, SQLite","Adaptability, Collaboration, Work Ethic, Empathy","Fitness Tracker App, E-commerce Mobile App, Task Automation Tool",Bangalore,Hyderabad,Gurgaon,OBC,IT,No,urban
C1688,Meera Srinivasan,B.E. in Mechanical Engineering,"SolidWorks, CAD (AutoCAD), Vehicle Dynamics, Manufacturing Processes, Embedded Systems, Battery Management","Collaboration, Attention to detail, Leadership, Adaptability","CAD Suspension Design, Vehicle Testing Module",Noida,Kolkata,Pune,SC,Automotive,No,urban
C1689,Shruti Patel,B.Tech in Electrical Engineering,"Embedded Systems, Control Systems, BMS (Battery Management Systems), Automotive Testing, CAN Bus","Collaboration, Attention to Detail, Time Management","BMS Development, EV Range Optimization, Vehicle Testing Module",Noida,Chennai,Pune,OBC,Automotive,No,rural
C1690,Meera,B.Tech CSE,"React, HTML, Next.js, TypeScript, Vue.js","Time Management, Communication, Critical Thinking",Portfolio Website,Mumbai,Bangalore,Hyderabad,ST,IT,Yes,urban
C1691,Manoj SinhaII,B.Sc in Chemistry,"Analytical Techniques (GC), Spectroscopy, Quality Assurance, Analytical Techniques (HPLC), Process Simulation, P&ID Design","Critical Thinking, Attention to Detail, Teamwork, Time Management","GC Method Validation, Formulation Testing, Material Testing Report",Ahmedabad,Jamnagar,Baroda,OBC,Chemical Industry,No,urban
C1692,Gaurav Choudhary,B.Com,"Android, REST APIs, Java, Firebase, Swift, TypeScript, Redis, Linux","Attention to Detail, Time Management, Critical Thinking","Offline Notes App, Inventory System",Gurgaon,Hyderabad,Bangalore,GEN,IT,No,urban
C1812,Pooja Mishra,B.Sc in Information Technology,"Firewall Configuration, Linux, Java, Artificial Intelligence, PHP, SQL, Operating Systems, Data Structures","Critical Thinking, Creativity, Communication","Log Monitoring Dashboard, E-commerce Website",Bangalore,Gurgaon,Hyderabad,GEN,IT,No,urban
C1693,Rohan Mehta,B.Tech in Chemical Engineering,"Process Optimization, Safety Standards, P&ID Design, Process Simulation (Aspen HYSYS), Analytical Chemistry, Material Testing","Attention to Detail, Collaboration, Decision Making","Safety Compliance Review, Process Simulation Study, Energy Balance Optimization",Baroda,Ahmedabad,Jamnagar,GEN,Chemical Industry,No,urban
C1694,Siddharth Verma,B.E. in Industrial Design,"Mechanical Design, Material Science, Vehicle Testing, Vehicle Dynamics, Manufacturing Processes, Embedded Systems, Battery Technology","Collaboration, Attention to detail, Critical thinking","CAD Suspension Design, Battery Performance Analysis",Ahmedabad,Pune,Noida,GEN,Automotive,No,urban
C1695,Karthik Rao,B.Tech in Artificial Intelligence,"PowerBI, Python, Machine Learning, Hadoop, R, Matplotlib, TensorFlow","Critical Thinking, Analytical Thinking, Teamwork","EDA on Retail Data, Customer Churn Prediction",Bangalore,Hyderabad,Gurgaon,OBC,IT,No,urban
C1696,Simran Bhatia,B.Tech in Artificial Intelligence,"PowerBI, Feature Engineering, Machine Learning, Web Development, DevOps","Critical Thinking, Problem-Solving, Teamwork","House Price Prediction, PowerBI Dashboard",Bangalore,Hyderabad,Gurgaon,OBC,IT,No,urban
C1697,Amit Reddy,B.Sc in Economics,"Documentation, Audit Procedures, Risk & Compliance Knowledge, Excel, Financial Modeling, Financial Analysis","Critical Thinking, Collaboration, Ethical Judgment","Regulatory Summary, Audit Compliance Report",Hyderabad,Mumbai,Ahmedabad,OBC,Banking & Financial Services,No,urban
C1698,Shruti Kulkarni,B.Tech in Software Engineering,"Flutter, Java, Git, Android, Swift, Docker, JavaScript, AWS, Redis","Problem-Solving, Empathy, Leadership","Media Streaming App, Data Visualization Dashboard",Hyderabad,Bangalore,Gurgaon,OBC,IT,No,urban
C1699,Priya Mehta,B.Sc in Mathematics,"Python, Feature Engineering, Hadoop, Pandas, DevOps","Critical Thinking, Adaptability, Communication","Predictive Sales Model, Game Development",Gurgaon,Bangalore,Hyderabad,OBC,IT,No,urban
C1700,Aarav Sharma,B.Sc in Mechanical Engineering,"Finite Element Analysis, Design Optimization, Vehicle Dynamics, Manufacturing Processes, Battery Management","Collaboration, Teamwork, Leadership","Prototype Testing, Embedded Systems Integration",Pune,Bangalore,Noida,EWS,Automotive,Yes,rural
C1701,Gaurav Gupta,B.Sc in Information Technology,"Flutter, iOS, Kotlin, Java, Machine Learning","Communication, Problem-Solving, Decision Making","Offline Notes App, Real-time Location App",Gurgaon,Hyderabad,Bangalore,GEN,IT,No,urban
C1702,Pranav Dutta,B.E. in Industrial Design,"SolidWorks, Prototyping, Mechanical Design, Material Science, Finite Element Analysis, Design Optimization, CATIA, CAD (AutoCAD), 3D Modeling","Collaboration, Teamwork, Creativity","Material Strength Analysis, CAD Suspension Design, Design Optimization Study",Bangalore,Pune,Noida,GEN,Automotive,No,urban
C1703,Aarav Sharma,B.Sc in Mathematics,"Python, PowerBI, Data Visualization, DevOps, Cloud, Kubernetes","Problem-Solving, Analytical Thinking, Teamwork","EDA on Retail Data, Predictive Sales Model",Bangalore,Hyderabad,Gurgaon,GEN,IT,Yes,urban
C1704,Advait,BCA,"HTML, React, TypeScript, Vue.js, Angular, Next.js","Teamwork, Communication, Critical Thinking",Portfolio Website,Chennai,Mumbai,Pune,ST,IT,No,urban
C1705,Vikram Rao,B.Sc in Mechanical Engineering,"Finite Element Analysis, Design Optimization, Vehicle Testing, Manufacturing Processes, Embedded Systems, Battery Technology","Teamwork, Leadership, Critical thinking","Design Optimization Study, Manufacturing Workflow Study",Pune,Noida,Hyderabad,GEN,Automotive,No,urban
C1706,Kunal Jain,B.Tech in Electrical Engineering,"IoT, CAD (AutoCAD/CATIA/SolidWorks), Thermal Management, Energy Storage Systems, Manufacturing Processes","Creativity, Teamwork, Communication","BMS Development, CAD Component Modeling",Noida,Pune,Bangalore,GEN,Automotive,Yes,urban
C1707,Neha Kulkarni,B.Sc in Chemistry,"Safety Standards, Excel, Heat & Mass Transfer, Process Simulation (Aspen HYSYS), Quality Control, Spectroscopy","Attention to Detail, Collaboration, Communication","Process Simulation Study, Material Balance Study, Safety Compliance Review",Chennai,Baroda,Jamnagar,OBC,Chemical Industry,No,urban
C1708,Meera ReddyIII,B.Tech in Biochemical Engineering,"Quality Assurance, Laboratory Testing, Spectroscopy, Lab Safety, Quality Control, Material Testing","Collaboration, Critical Thinking, Adaptability, Time Management","HPLC Analysis, Lab Experimentation, Material Testing Report",Baroda,Jamnagar,Mumbai,OBC,Chemical Industry,No,urban
C1709,Ila Shah,B.Tech in Electronics Engineering,"MATLAB/Simulink, Battery Technology, Embedded Systems, Control Systems, Power Electronics","Collaboration, Problem-solving, Creativity","BMS Development, IoT Sensor Integration",Noida,Kolkata,Pune,ST,Automotive,No,urban
C1710,Siddharth Singh,B.Sc in Economics,"Documentation, Compliance Monitoring, Legal Drafting, Audit Procedures, Banking Operations, Financial Analysis","Attention to Detail, Communication, Ethical Judgment","Audit Compliance Report, Compliance Audit Report",Chennai,Hyderabad,Mumbai,GEN,Banking & Financial Services,No,rural
C1711,Kavya MenonII,B.E in Chemical Engineering,"Chemical Analysis, Laboratory Testing, Documentation, Analytical Techniques (HPLC), Process Optimization, Process Safety","Collaboration, Critical Thinking, Teamwork, Time Management","GC Method Validation, HPLC Analysis, P&ID Design Analysis",Kolkata,Baroda,Jamnagar,SC,Chemical Industry,No,urban
C1712,Sneha Shah,BBA in Business Administration,"Client Documentation, Market Research, Investment Analysis, Data Analysis, Interest Rate Analytics","Critical Thinking, Leadership, Ethical Judgment","Corporate Client Presentation, Investment Portfolio Analysis",Nagpur,Mumbai,Hyderabad,EWS,Banking & Financial Services,No,urban
C1713,Suresh PillaiIII,B.E in Chemical Engineering,"Documentation, Research Skills, Process Simulation, Process Safety, P&ID Design","Collaboration, Adaptability, Creativity","Prototype Formulation, P&ID Design Analysis",Baroda,Chennai,Jamnagar,GEN,Chemical Industry,No,urban
C1714,Devansh Nair,B.Sc in Economics,"Cash Flow Analysis, Treasury Operations Basics, Data Analysis, Interest Rate Analytics, Tax Compliance","Attention to Detail, Leadership, Adaptability","Treasury Cash Flow Report, Financial Data Cleaning",Bangalore,Mumbai,Hyderabad,GEN,Banking & Financial Services,No,rural
C1715,Karan Bhatia,B.Sc in Industrial Chemistry,"Process Simulation (ChemCAD), Excel, Spectroscopy, Quality Control, Environmental Monitoring","Problem-Solving, Teamwork, Communication","Energy Balance Optimization, Material Balance Study, Spectroscopy Analysis",Jamnagar,Baroda,Ahmedabad,OBC,Chemical Industry,No,urban
C1716,Zoya Rastogi,B.Tech in Electrical Engineering,"BMS (Battery Management Systems), Chassis Design, Energy Storage Systems, Automotive Testing, Thermal Management","Critical Thinking, Creativity, Time Management","Battery Performance Testing, Vehicle Testing Module",Noida,Chennai,Pune,GEN,Automotive,No,urban
C1717,Arjun Patel,B.Tech in Chemical Engineering,"Laboratory Testing, Quality Assurance, Chemical Analysis, Lab Safety, Material Testing, P&ID Design","Attention to Detail, Critical Thinking, Teamwork, Communication","Lab Experimentation, GC Method Validation, Material Testing Report",Chennai,Baroda,Jamnagar,GEN,Chemical Industry,No,urban
C1718,Neha KulkarniII,B.Tech in Biochemical Engineering,"Research Skills, Spectroscopy, Laboratory Testing, Chemical Analysis, Process Simulation, Material Testing","Attention to Detail, Critical Thinking, Adaptability, Communication","Prototype Formulation, Quality Report Preparation, Process Flow Optimization",Jamnagar,Jaipur,Baroda,GEN,Chemical Industry,No,urban
C1719,Shruti Mehta,B.Tech in Information Technology,"Network Security, Cloud Security, IDS/IPS, Cryptography, Wireshark, SIEM Tools, Java","Critical Thinking, Attention to Detail, Problem-Solving, Interpersonal Skills","Firewall Implementation, Network Vulnerability Scanner, Data Encryption Tool, Penetration Testing Script",Gurgaon,Hyderabad,Bangalore,SC,IT,No,urban
C1720,Divya Singh,B.Tech in Biochemical Engineering,"Quality Assurance, Laboratory Testing, Process Safety, Process Optimization, Material Testing","Critical Thinking, Leadership, Time Management","Quality Report Preparation, P&ID Design Analysis",Jaipur,Jamnagar,Baroda,GEN,Chemical Industry,No,urban
C1721,Rahul Patel,B.Tech in Information Technology,"Java, JSON, React Native, Android, XML, TypeScript, AWS, Python, HTML","Collaboration, Attention to Detail, Time Management","E-commerce Mobile App, Task Automation Tool",Hyderabad,Bangalore,Gurgaon,GEN,IT,No,rural
C1722,Sameer Banerjee,BBA in Business Administration,"Treasury Reporting, Financial Statement Analysis, Tax Compliance, Banking Operations, Data Analysis","Communication, Adaptability, Leadership","Corporate Client Presentation, Tax Compliance Report",Mumbai,Hyderabad,Chennai,GEN,Banking & Financial Services,No,urban
C1723,Sneha Iyer,B.Sc in Chemistry,"Process Simulation (ChemCAD), Excel, Chemical Engineering Fundamentals, Heat & Mass Transfer, P&ID Design, Safety Standards, Polymer Testing","Problem-Solving, Attention to Detail, Collaboration, Leadership","Material Balance Study, Safety Compliance Review, Process Simulation Study",Baroda,Jamnagar,Jaipur,ST,Chemical Industry,No,rural
C1724,Neha Malhotra,B.A. in Economics,"Treasury Operations Basics, Cash Flow Analysis, Risk Assessment, Banking Regulations (Basics), Financial Modeling, Interest Rate Analytics","Attention to Detail, Collaboration, Leadership","FX Research Summary, Treasury Cash Flow Report",Bangalore,Hyderabad,Mumbai,SC,Banking & Financial Services,Yes,urban
C1725,Aman Yadav,B.Sc in Statistics,"Python, EDA, PowerBI, Data Visualization, Feature Engineering, Pandas, Cybersecurity","Analytical Thinking, Critical Thinking, Problem-Solving, Adaptability","Customer Churn Prediction, House Price Prediction, EDA on Retail Data",Hyderabad,Gurgaon,Bangalore,GEN,IT,No,urban
C1726,Sahana Khandelwal,B.Com in Banking,"Excel, Treasury Operations Basics, Financial Statement Analysis, Banking Regulations (Basics), Cash Flow Analysis, Investment Analysis","Attention to Detail, Critical Thinking, Adaptability","Corporate Client Presentation, Market Trend Analysis",Hyderabad,Mumbai,Kolkata,GEN,Banking & Financial Services,Yes,urban
C1727,Rohan Verma,B.Tech in Artificial Intelligence,"Python, Cloud, Web Development, C++, Cybersecurity","Communication, Collaboration, Critical Thinking, Leadership",Blog Website,Bangalore,Gurgaon,Hyderabad,GEN,IT,No,urban
C1728,Vikram Malhotra,B.Com in Accounting,"Documentation, Compliance Monitoring, Excel, Audit Procedures, Data Analysis, Financial Modeling","Communication, Collaboration, Ethical Judgment","Documentation Review, Compliance Audit Report",Mumbai,Hyderabad,Ahmedabad,GEN,Banking & Financial Services,No,urban
C1729,Arjun Nair,B.Com in Accounting,"Compliance Monitoring, Audit Procedures, Banking Operations, Risk Assessment, Financial Analysis","Critical Thinking, Ethical Judgment, Adaptability","Risk Assessment Study, Market Analysis Report",Mumbai,Hyderabad,Ahmedabad,GEN,Banking & Financial Services,No,urban
C1730,Milan Joshi,B.Tech in Electrical Engineering,"MATLAB/Simulink, CAN Bus, Thermal Management, Automotive Testing, Vehicle Dynamics","Creativity, Time Management, Communication","MATLAB Control Model, CAD Component Modeling",Pune,Hyderabad,Noida,OBC,Automotive,Yes,urban
C1731,Simran Kaur,B.Sc in Chemistry,"Problem-Solving, Quality Assurance, Research Skills, Documentation, Chemical Synthesis, Process Simulation","Attention to Detail, Critical Thinking, Adaptability, Creativity","Lab Experimentation, Formulation Testing, Material Testing Report",Hyderabad,Jamnagar,Baroda,GEN,Chemical Industry,No,rural
C1732,Neha Kulkarni,B.Tech in Process Engineering,"Process Simulation (Aspen HYSYS), Safety Standards, Excel, Heat & Mass Transfer, Environmental Monitoring, Quality Control","Collaboration, Attention to Detail, Teamwork","Heat Exchanger Design, Energy Balance Optimization, Process Simulation Study",Jamnagar,Jaipur,Baroda,GEN,Chemical Industry,No,urban
C1733,Divya Kapoor,B.E. in Mechanical Engineering,"Material Science, 3D Modeling, Vehicle Testing, Manufacturing Processes, Embedded Systems, Battery Management","Attention to detail, Teamwork, Leadership, Creativity","3D Component Modeling, Embedded Systems Integration",Pune,Mumbai,Noida,GEN,Automotive,No,urban
C1734,Mahika Choudhary,B.A in Economics,"Flutter, REST APIs, Firebase, iOS, Dart, TypeScript","Communication, Adaptability, Creativity","API-Integrated News App, Cross-Platform Chat App",Hyderabad,Gurgaon,Bangalore,GEN,IT,No,urban
C1735,Kabir,BCA,"JavaScript, Node.js, HTML, Vue.js, SQL, Git","Teamwork, Problem Solving, Critical Thinking","Task Manager App, Online Learning Platform",Bangalore,Gurgaon,Hyderabad,OBC,IT,Yes,urban
C1736,Kabir,B.Tech IT,"JavaScript, HTML, Vue.js, Docker, Python, SQL","Collaboration, Problem Solving, Time Management, Creativity",Social Media Clone,Gurgaon,Hyderabad,Chennai,OBC,IT,No,urban
C1737,Arjun Pillai,B.Sc in Data Science,"Python, Data Visualization, Machine Learning, R, Seaborn","Collaboration, Problem-Solving, Creativity","Predictive Sales Model, House Price Prediction",Gurgaon,Hyderabad,Bangalore,SC,IT,No,urban
C1738,Arjun PatelII,B.Sc in Industrial Chemistry,"Lab Safety, Analytical Techniques (GC), Research Skills, Documentation, Process Optimization, Process Safety","Critical Thinking, Attention to Detail, Leadership, Communication","Formulation Testing, Spectroscopy Study, Process Flow Optimization",Jamnagar,Hyderabad,Baroda,GEN,Chemical Industry,No,urban
C1739,Ananya Mishra,B.E. in Industrial Design,"Design Optimization, Vehicle Testing, Vehicle Dynamics, Manufacturing Processes, Embedded Systems, Battery Technology, Battery Management","Time management, Critical thinking, Creativity",Material Strength Analysis,Hyderabad,Noida,Pune,ST,Automotive,No,urban
C1740,Vikram JoshiII,B.Tech in Chemical Engineering,"Documentation, Analytical Techniques (GC), Lab Safety, Chemical Analysis, Material Testing, P&ID Design","Critical Thinking, Collaboration, Leadership, Teamwork","Quality Report Preparation, Formulation Testing, Process Flow Optimization",Mumbai,Jamnagar,Baroda,GEN,Chemical Industry,No,urban
C1741,Aisha,B.Tech CSE,"MongoDB, Node.js, Angular, Next.js, Kubernetes, Vue.js, TypeScript","Critical Thinking, Time Management, Leadership",Chat Application,Bangalore,Pune,Gurgaon,ST,IT,Yes,rural
C1742,Rahul Chawla,B.Tech in Information Technology,"Feature Engineering, EDA, Java, Docker, TensorFlow, Cybersecurity","Critical Thinking, Adaptability, Leadership, Teamwork","PowerBI Dashboard, Game Development",Gurgaon,Bangalore,Hyderabad,GEN,IT,No,urban
C1743,Karthik Rao,B.Tech in Artificial Intelligence,"PowerBI, TensorFlow, Web Development, DevOps, Linux, Cloud","Leadership, Adaptability, Teamwork, Problem-Solving",Blog Website,Gurgaon,Bangalore,Hyderabad,GEN,IT,No,urban
C1744,Rajeev Kulkarni,B.Tech in Mechanical Engineering,"SolidWorks, Mechanical Design, Material Science, CATIA, 3D Modeling, Vehicle Testing, Vehicle Dynamics, Battery Technology","Teamwork, Critical thinking, Creativity","Prototype Testing, Design Optimization Study, 3D Component Modeling",Kolkata,Pune,Noida,GEN,Automotive,No,urban
C1745,Rohan GuptaII,B.Tech in Biochemical Engineering,"Laboratory Testing, Chemical Analysis, Quality Assurance, Analytical Techniques (HPLC), Process Safety, Chemical Synthesis","Critical Thinking, Attention to Detail, Communication, Adaptability","HPLC Analysis, Quality Report Preparation, Simulation Study",Ahmedabad,Jamnagar,Baroda,GEN,Chemical Industry,No,urban
C1746,Meera Srinivasan,B.E. in Mechanical Engineering,"SolidWorks, 3D Modeling, Vehicle Testing, Embedded Systems, Battery Technology, Battery Management","Attention to detail, Leadership, Creativity, Adaptability","Design Optimization Study, Vehicle Testing Module",Chennai,Noida,Pune,GEN,Automotive,Yes,urban
