candidate_id,name,candidate_degree,technical_skills,soft_skills,projects,location_preference_1,location_preference_2,location_preference_3,social_category,sector_interest,past_participation,location_category
C1045,Rohan Iyer,B.Tech in Automotive Engineering,"Mechanical Design, Vehicle Testing, Vehicle Dynamics, Embedded Systems, Battery Management","Collaboration, Time management, Teamwork",Manufacturing Workflow Study,Kolkata,Noida,Pune,GEN,Automotive,Yes,urban
C1046,Vikram Pillai,B.E. in Chemical Engineering,"Process Simulation (ChemCAD), Safety Standards, Quality Control, Environmental Monitoring, Material Testing","Problem-Solving, Critical Thinking, Creativity","Process Flow Optimization, Heat Exchanger Design, Spectroscopy Analysis",Baroda,Jaipur,Jamnagar,OBC,Chemical Industry,No,urban
C1047,Aarav Joshi,B.A. in Economics,"Audit Procedures, Legal Drafting, Excel, Risk & Compliance Knowledge, Tax Compliance, Banking Operations","Communication, Collaboration, Leadership","Regulatory Summary, Compliance Audit Report",Mumbai,Bangalore,Hyderabad,SC,Banking & Financial Services,No,urban
C1048,Pranav Dutta,B.Tech in Automotive Engineering,"Material Science, CAD (AutoCAD), Manufacturing Processes, Embedded Systems, Battery Technology, Battery Management","Time management, Leadership, Critical thinking, Adaptability","CAD Suspension Design, Battery Performance Analysis",Pune,Noida,Bangalore,OBC,Automotive,Yes,urban
C1049,Ishita Das,B.Sc in Data Science,"EDA, PowerBI, C++, R, Web Development, Cybersecurity, Cloud","Problem-Solving, Communication, Creativity","House Price Prediction, Cooking Recipe Classifier",Hyderabad,Gurgaon,Bangalore,OBC,IT,No,urban
C1050,Aarav Sharma,B.Sc in Mechanical Engineering,"Mechanical Design, Material Science, CATIA, CAD (AutoCAD), 3D Modeling, Vehicle Dynamics, Manufacturing Processes, Embedded Systems, Battery Management","Problem-solving, Time management, Creativity, Adaptability","Design Optimization Study, 3D Component Modeling, CAD Suspension Design",Noida,Ahmedabad,Pune,GEN,Automotive,No,urban
C1051,Ishaan,BCA,"HTML, CSS, Node.js, GraphQL, TypeScript, Git, Python","Teamwork, Adaptability, Critical Thinking","Blog Platform, Online Learning Platform",Pune,Bangalore,Chennai,OBC,IT,No,rural
C1052,Meera Singh,BBA in Business Administration,"Risk & Compliance Knowledge, Compliance Monitoring, Tax Compliance, Risk Assessment, Financial Modeling","Communication, Leadership, Ethical Judgment","Documentation Review, Financial Data Analysis",Bangalore,Hyderabad,Mumbai,EWS,Banking & Financial Services,No,urban
C1053,Vihaan,B.Tech IT,"React, CSS, Angular, Java, Python, SQL, Kubernetes","Critical Thinking, Problem Solving, Leadership, Teamwork",Social Media Clone,Gurgaon,Mumbai,Hyderabad,SC,IT,No,urban
C1054,Simran Kapoor,B.E. in Petroleum Engineering,"Excel, Chemical Engineering Fundamentals, P&ID Design, Process Optimization, Heat & Mass Transfer, Safety Standards, Material Testing","Collaboration, Attention to Detail, Problem-Solving, Teamwork","Process Flow Optimization, Heat Exchanger Design, Safety Compliance Review",Mumbai,Baroda,Jamnagar,SC,Chemical Industry,No,urban
C1055,Aarav Rastogi,B.Tech in Information Technology,"Firebase, Dart, Flutter, Kotlin, REST APIs","Collaboration, Communication, Leadership","Offline Notes App, API-Integrated News App",Bangalore,Hyderabad,Gurgaon,SC,IT,No,urban
C1056,Rahul ChoudharyII,B.Tech in Chemical Engineering,"Spectroscopy, Research Skills, Analytical Techniques (GC), Laboratory Testing, Process Safety, Process Optimization","Attention to Detail, Collaboration, Communication, Time Management","Lab Experimentation, Prototype Formulation, Simulation Study",Jamnagar,Baroda,Kolkata,GEN,Chemical Industry,No,urban
C1057,Manish Yadav,B.Tech in Chemical Engineering,"Excel, Process Simulation (ChemCAD), Process Simulation (Aspen HYSYS), Heat & Mass Transfer, Lab Safety, Polymer Testing","Collaboration, Attention to Detail, Time Management","Process Simulation Study, Process Flow Optimization, Energy Balance Optimization",Chennai,Baroda,Jamnagar,SC,Chemical Industry,No,urban
C1058,Neha Sinha,B.Tech in Artificial Intelligence,"Feature Engineering, Python, EDA, DevOps, Seaborn, Networking","Analytical Thinking, Collaboration, Adaptability","Predictive Sales Model, EDA on Retail Data",Gurgaon,Hyderabad,Bangalore,EWS,IT,No,urban
C1059,Aarav Sharma,B.E. in Petroleum Engineering,"Chemical Engineering Fundamentals, Quality Control, Environmental Monitoring, Material Testing, Analytical Chemistry","Collaboration, Leadership, Time Management","Heat Exchanger Design, Spectroscopy Analysis",Baroda,Jamnagar,Jaipur,GEN,Chemical Industry,No,urban
C1060,Divya Gupta,B.Tech in Software Engineering,"Java, Kotlin, Dart, iOS, C++","Time Management, Adaptability, Teamwork","Fitness Tracker App, Offline Notes App",Bangalore,Hyderabad,Gurgaon,GEN,IT,No,urban
C1061,Rohan,B.Tech CSE,"Node.js, CSS, SQL, Kubernetes, Python, Angular","Adaptability, Creativity, Leadership",Portfolio Website,Gurgaon,Bangalore,Chennai,General,IT,Yes,urban
C1062,Aditya Nair,B.Sc in Mechanical Engineering,"Mechanical Design, CATIA, Vehicle Dynamics, Battery Technology, Battery Management","Problem-solving, Collaboration, Teamwork","Material Strength Analysis, Vehicle Testing Module",Chennai,Noida,Pune,GEN,Automotive,No,urban
C1063,Neha Sinha,B.Sc in Statistics,"Data Visualization, Hadoop, Seaborn, TensorFlow, DevOps, Networking","Critical Thinking, Problem-Solving, Teamwork",House Price Prediction,Bangalore,Gurgaon,Hyderabad,EWS,IT,No,urban
C1064,Manish Yadav,B.E. in Chemical Engineering,"Heat & Mass Transfer, Chemical Engineering Fundamentals, P&ID Design, Process Simulation (ChemCAD), Quality Control, Material Testing","Attention to Detail, Collaboration, Creativity","Energy Balance Optimization, Process Flow Optimization, Process Simulation Study",Ahmedabad,Jamnagar,Baroda,GEN,Chemical Industry,No,rural
C1065,Lakshmi Chopra,B.A in Economics,"Bash Scripting, SIEM Tools, Penetration Testing, Wireshark, JavaScript, Operating Systems, CSS, Machine Learning","Critical Thinking, Attention to Detail, Work Ethic","Log Monitoring Dashboard, SIEM Alert Analyzer, Chat Application",Gurgaon,Hyderabad,Bangalore,GEN,IT,No,urban
C1066,Milan Rastogi,B.Sc in Economics,"Banking Regulations (Basics), Treasury Operations Basics, Financial Modeling, Cash Flow Analysis, Portfolio Management","Critical Thinking, Collaboration, Leadership","Market Trend Analysis, Client Onboarding Documentation",Hyderabad,Jaipur,Mumbai,SC,Banking & Financial Services,No,urban
C1067,Saanvi,MCA,"HTML, React, GraphQL, Vue.js, Java, Git","Leadership, Teamwork, Collaboration",Chat Application,Chennai,Gurgaon,Pune,OBC,IT,Yes,urban
C1068,Advait,BCA,"CSS, React, Node.js, HTML, Next.js, Kubernetes, TypeScript, GraphQL","Teamwork, Adaptability, Collaboration","Task Manager App, E-commerce Website",Gurgaon,Hyderabad,Mumbai,OBC,IT,No,urban
C1069,Rhea Iyer,BBA in Business Administration,"Risk Assessment, Excel, Financial Modeling, Treasury Operations Basics, Cash Flow Analysis, Banking Operations","Collaboration, Attention to Detail, Ethical Judgment","FX Research Summary, Corporate Client Presentation",Hyderabad,Kolkata,Mumbai,GEN,Banking & Financial Services,No,urban
C2008,Ishaan,B.Tech CSE,"React, CSS, MongoDB, SQL, Docker, Git","Communication, Adaptability, Leadership","E-commerce Website, Online Learning Platform",Hyderabad,Pune,Chennai,SC,IT,Yes,urban
C1070,Simran Mishra,B.Tech in Information Technology,"iOS, Flutter, Android, Firebase, REST APIs","Time Management, Organization, Critical Thinking","Media Streaming App, Fitness Tracker App, Weather Forecasting App",Hyderabad,Bangalore,Gurgaon,OBC,IT,No,urban
C1071,Ishaan,BCA,"CSS, React, Node.js, MongoDB, JavaScript, Docker, GraphQL, TypeScript","Adaptability, Problem Solving, Communication, Time Management, Collaboration","Task Manager App, E-commerce Website, Blog Platform, Social Media Clone",Mumbai,Pune,Bangalore,General,IT,No,urban
C1072,Ananya Iyer,B.Tech in Computer Science,"Machine Learning, Data Visualization, Feature Engineering, DevOps, Web Development, Cloud, NumPy","Problem-Solving, Critical Thinking, Creativity","Predictive Sales Model, House Price Prediction",Bangalore,Hyderabad,Gurgaon,OBC,IT,No,urban
C1073,Neha Joshi,B.Com in Finance,"Risk & Compliance Knowledge, Compliance Monitoring, Documentation, Legal Drafting, Tax Compliance, Banking Operations","Collaboration, Attention to Detail, Time Management","Compliance Audit Report, Regulatory Summary",Hyderabad,Bangalore,Mumbai,GEN,Banking & Financial Services,No,urban
C1074,Saanvi,MCA,"HTML, Node.js, SQL, Python, Vue.js, Git","Communication, Teamwork, Critical Thinking",Job Portal,Bangalore,Chennai,Gurgaon,OBC,IT,Yes,rural
C1075,Advait,MCA,"React, JavaScript, CSS, Node.js, MongoDB, Angular, Vue.js, Git","Teamwork, Adaptability, Communication, Leadership","Task Manager App, E-commerce Website, Blog Platform, Online Learning Platform",Gurgaon,Bangalore,Chennai,OBC,IT,Yes,rural
C1076,Vihaan,B.Tech CSE,"HTML, MongoDB, JavaScript, SQL, Java","Communication, Problem Solving, Collaboration","Blog Platform, Online Learning Platform",Pune,Gurgaon,Mumbai,General,IT,No,urban
C1077,Vihaan,B.Tech IT,"JavaScript, React, Vue.js, Angular, Git","Teamwork, Creativity, Adaptability, Communication",Portfolio Website,Pune,Gurgaon,Chennai,General,IT,No,urban
C1078,Isha Gupta,B.Tech in Information Technology,"Bash Scripting, Python, Ethical Hacking, IDS/IPS, Wireshark, Cryptography, Machine Learning, PHP","Attention to Detail, Critical Thinking, Problem-Solving","SIEM Alert Analyzer, Firewall Implementation, Penetration Testing Script",Hyderabad,Bangalore,Gurgaon,GEN,IT,No,urban
C1079,Yash Bose,B.Tech in Electrical Engineering,"BMS (Battery Management Systems), CAD (AutoCAD/CATIA/SolidWorks), Thermal Management, Automotive Testing, Vehicle Dynamics","Time Management, Communication, Leadership","BMS Development, CAD Component Modeling",Kolkata,Pune,Noida,GEN,Automotive,No,urban
C1080,Rekha Iyer,BBA in Finance,"Excel, Treasury Reporting, Tax Compliance, Investment Analysis, Interest Rate Analytics","Attention to Detail, Leadership, Adaptability","Market Trend Analysis, Banking Ops Mapping",Pune,Mumbai,Hyderabad,GEN,Banking & Financial Services,No,urban
C1081,Ritika Joshi,B.Sc in Mechanical Engineering,"Design Optimization, CAD (AutoCAD), Vehicle Testing, Manufacturing Processes, Embedded Systems","Problem-solving, Collaboration, Attention to detail, Leadership","Material Strength Analysis, Embedded Systems Integration",Pune,Noida,Mumbai,GEN,Automotive,No,rural
C1082,Ritika Saxena,B.Sc in Mathematics,"Machine Learning, EDA, Networking, Docker, R, NumPy, Matplotlib","Collaboration, Teamwork, Leadership, Communication","Customer Churn Prediction, Cooking Recipe Classifier",Bangalore,Gurgaon,Hyderabad,GEN,IT,No,urban
C1083,Aarav Sharma,B.Sc in Chemistry,"Safety Standards, Polymer Testing, Material Testing, Quality Control, Spectroscopy","Problem-Solving, Leadership, Decision Making","Safety Compliance Review, Chemical Sample Testing",Jamnagar,Mumbai,Baroda,GEN,Chemical Industry,No,urban
C1084,Neha KulkarniJr.,B.Sc in Industrial Chemistry,"Laboratory Testing, Analytical Techniques (GC), P&ID Design, Chemical Synthesis, Material Testing","Attention to Detail, Communication, Teamwork","Spectroscopy Study, Chemical Synthesis Trial",Ahmedabad,Jamnagar,Baroda,OBC,Chemical Industry,No,urban
C1085,Aditya Mishra,BBA in Business Administration,"Legal Drafting, Excel, Audit Procedures, Risk & Compliance Knowledge, Financial Modeling, Tax Compliance","Collaboration, Attention to Detail, Adaptability","Documentation Review, Regulatory Summary",Hyderabad,Mumbai,Bangalore,GEN,Banking & Financial Services,No,urban
C1086,Shruti Kulkarni,B.Sc in Computer Science,"Python, Penetration Testing, Data Structures, PHP, Artificial Intelligence","Problem-Solving, Adaptability, Interpersonal Skills","Firewall Implementation, E-commerce Website",Hyderabad,Bangalore,Gurgaon,OBC,IT,No,urban
C1087,Sakshi Mehta,B.Tech in Mechanical Engineering,"MATLAB/Simulink, Battery Technology, Energy Storage Systems, CAN Bus, CAD (AutoCAD/CATIA/SolidWorks)","Communication, Time Management, Teamwork","IoT Sensor Integration, Vehicle Testing Module",Bangalore,Noida,Pune,EWS,Automotive,No,urban
C1088,Ritika Saxena,B.Tech in Information Technology,"Python, Machine Learning, Data Visualization, Feature Engineering, EDA, SQL, Matplotlib, Hadoop","Analytical Thinking, Problem-Solving, Collaboration, Communication","EDA on Retail Data, House Price Prediction, Customer Churn Prediction",Hyderabad,Gurgaon,Bangalore,GEN,IT,No,urban
C1089,Tanya Mishra,B.Sc in Statistics,"PowerBI, Data Visualization, SQL, Cloud, Java, Hadoop","Collaboration, Creativity, Teamwork","House Price Prediction, Wedding Photography App",Gurgaon,Hyderabad,Bangalore,EWS,IT,No,urban
C1090,Harsh Patel,B.E. in Mechanical Engineering,"Prototyping, CAD (AutoCAD), Vehicle Dynamics, Manufacturing Processes, Embedded Systems, Battery Technology, Battery Management","Problem-solving, Leadership, Creativity, Adaptability","CAD Suspension Design, Manufacturing Workflow Study",Pune,Noida,Ahmedabad,SC,Automotive,No,urban
C1091,Vivek Joshi,B.Sc in Data Science,"Python, Seaborn, Cybersecurity, Hadoop, Cloud, Networking","Critical Thinking, Analytical Thinking, Teamwork, Adaptability",Predictive Sales Model,Bangalore,Gurgaon,Hyderabad,GEN,IT,No,urban
C1092,Kavya MenonII,B.Sc in Industrial Chemistry,"Chemical Analysis, Documentation, Lab Safety, Analytical Techniques (GC), Quality Control, P&ID Design","Collaboration, Critical Thinking, Adaptability, Teamwork","Spectroscopy Study, Lab Experimentation, Process Flow Optimization",Hyderabad,Jamnagar,Baroda,GEN,Chemical Industry,No,urban
C1093,Aarav,B.Tech IT,"Node.js, CSS, JavaScript, HTML, React, TypeScript, Next.js, SQL, Angular","Problem Solving, Teamwork, Communication, Critical Thinking, Collaboration","E-commerce Website, Task Manager App, Blog Platform, Social Media Clone",Gurgaon,Hyderabad,Chennai,General,IT,Yes,urban
C1094,Simran Singh,B.A. in Economics,"Audit Procedures, Legal Drafting, Risk & Compliance Knowledge, Compliance Monitoring, Financial Analysis, Risk Assessment","Attention to Detail, Critical Thinking, Leadership","Documentation Review, Regulatory Summary",Ahmedabad,Mumbai,Hyderabad,GEN,Banking & Financial Services,No,urban
C1095,Ananya Mishra,B.Tech in Automotive Engineering,"Material Science, Design Optimization, Vehicle Testing, Vehicle Dynamics, Manufacturing Processes, Battery Technology, Battery Management","Attention to detail, Creativity, Adaptability","Prototype Testing, Vehicle Testing Module",Pune,Kolkata,Noida,GEN,Automotive,No,urban
C1096,Aarav Mishra,B.Sc in Computer Science,"Bash Scripting, Network Security, SIEM Tools, IDS/IPS, Data Structures, Artificial Intelligence","Problem-Solving, Critical Thinking, Work Ethic","Penetration Testing Script, Network Vulnerability Scanner, Weather Forecasting App",Bangalore,Hyderabad,Gurgaon,GEN,IT,No,urban
C1097,Aman Gupta,B.Com,"Kali Linux, Cryptography, CSS, Computer Networks, Operating Systems, HTML, Artificial Intelligence, Java","Problem-Solving, Work Ethic, Creativity","Penetration Testing Script, Weather Forecasting App",Hyderabad,Bangalore,Gurgaon,GEN,IT,No,urban
C1098,Bhavesh Kohli,B.Tech in Mechanical Engineering,"Power Electronics, IoT, CAD (AutoCAD/CATIA/SolidWorks), CAN Bus, Manufacturing Processes","Creativity, Time Management, Leadership","EV Range Optimization, CAD Component Modeling",Jaipur,Pune,Noida,EWS,Automotive,No,urban
C1099,Neha Kulkarni,B.Tech in Chemical Engineering,"Process Simulation (ChemCAD), Excel, Heat & Mass Transfer, P&ID Design, Safety Standards, Process Optimization, Environmental Monitoring","Collaboration, Attention to Detail, Problem-Solving, Creativity","Process Flow Optimization, Material Balance Study, Safety Compliance Review",Baroda,Mumbai,Jamnagar,GEN,Chemical Industry,Yes,urban
C1100,Neha KulkarniJr.,B.Sc in Chemistry,"Spectroscopy, Lab Safety, Chemical Analysis, Quality Assurance, Chemical Synthesis, Quality Control","Attention to Detail, Critical Thinking, Creativity, Leadership","GC Method Validation, HPLC Analysis, Simulation Study",Jamnagar,Hyderabad,Baroda,GEN,Chemical Industry,No,urban
C1101,Ananya Mishra,B.E. in Industrial Design,"Design Optimization, 3D Modeling, Vehicle Testing, Manufacturing Processes, Battery Technology, Battery Management","Attention to detail, Teamwork, Adaptability","CAD Suspension Design, Embedded Systems Integration",Ahmedabad,Pune,Noida,GEN,Automotive,No,urban
C1102,Simran Nair,B.Com in Finance,"Market Research, Treasury Reporting, Cash Flow Analysis, Risk Assessment, Financial Modeling, Financial Statement Analysis","Collaboration, Communication, Critical Thinking","Corporate Client Presentation, Client Onboarding Documentation, Treasury Cash Flow Report, FX Research Summary",Kolkata,Mumbai,Hyderabad,GEN,Banking & Financial Services,Yes,urban
C1103,Devansh Singh,B.Sc in Data Science,"PowerBI, Python, EDA, Feature Engineering, Data Visualization, Hadoop, Networking, Web Development","Collaboration, Analytical Thinking, Critical Thinking, Teamwork","Predictive Sales Model, Fraud Detection Model, House Price Prediction",Bangalore,Gurgaon,Hyderabad,OBC,IT,No,urban
C1104,Meera,B.Tech IT,"MongoDB, JavaScript, Git, Docker, Vue.js, Kubernetes","Critical Thinking, Problem Solving, Leadership, Creativity",Online Learning Platform,Chennai,Mumbai,Pune,OBC,IT,Yes,urban
C1105,Manish Joshi,B.Com in Accounting,"Cash Flow Analysis, Treasury Operations Basics, Financial Statement Analysis, Market Research, Banking Operations","Communication, Attention to Detail, Adaptability","Treasury Report Preparation, Client Onboarding Documentation, Tax Compliance Report",Bangalore,Mumbai,Hyderabad,OBC,Banking & Financial Services,No,urban
C1106,Aarav Jain,B.Com in Accounting,"Risk & Compliance Knowledge, Compliance Monitoring, Excel, Documentation, Financial Analysis, Data Analysis","Attention to Detail, Critical Thinking, Ethical Judgment","Risk Assessment Study, Compliance Audit Report",Bangalore,Hyderabad,Mumbai,GEN,Banking & Financial Services,No,rural
C1107,Krishna Ghosh,B.Sc in Computer Science,"Network Security, Java, HTML, JavaScript, Artificial Intelligence, Operating Systems, SQL","Critical Thinking, Interpersonal Skills, Work Ethic","Weather Forecasting App, Blog Application, Library Management System",Gurgaon,Bangalore,Hyderabad,OBC,IT,No,urban
C1108,Mitali Malhotra,B.Tech in Mechanical Engineering,"Battery Technology, Thermal Management, Vehicle Dynamics, CAD (AutoCAD/CATIA/SolidWorks), Sensor Integration","Collaboration, Time Management, Teamwork","MATLAB Control Model, CAD Component Modeling",Mumbai,Pune,Noida,GEN,Automotive,No,urban
C1109,Mahika Patel,B.A in Economics,"XML, Dart, Kotlin, Android, Firebase, Java","Adaptability, Time Management, Prioritization","E-commerce Mobile App, Offline Notes App, Firebase Auth Demo",Bangalore,Hyderabad,Gurgaon,GEN,IT,No,urban
C1110,Mitali Chauhan,B.Tech in Electrical Engineering,"IoT, Power Electronics, Control Systems, Battery Technology, Embedded Systems","Adaptability, Leadership, Time Management","MATLAB Control Model, BMS Development",Chennai,Noida,Pune,GEN,Automotive,No,urban
C1111,Meera Joshi,B.Sc in Chemistry,"Excel, Chemical Engineering Fundamentals, Safety Standards, Heat & Mass Transfer, Analytical Chemistry, Polymer Testing","Attention to Detail, Collaboration, Decision Making","Energy Balance Optimization, Heat Exchanger Design, Material Balance Study",Baroda,Hyderabad,Jamnagar,GEN,Chemical Industry,No,urban
C1112,Simran Chopra,B.Tech in Software Engineering,"Android, Flutter, REST APIs, Kotlin, Dart, Node.js, C++, TypeScript, Python","Prioritization, Time Management, Organization","API-Integrated News App, Blog Platform",Gurgaon,Bangalore,Hyderabad,GEN,IT,No,urban
C1113,Sneha Kulkarni,B.Sc in Statistics,"PowerBI, Data Visualization, Machine Learning, Cybersecurity, SQL, R, Cloud","Analytical Thinking, Critical Thinking, Adaptability","Fraud Detection Model, Predictive Sales Model",Hyderabad,Bangalore,Gurgaon,GEN,IT,Yes,urban
C1114,Aarav Sharma,B.Sc in Mathematics,"Python, Feature Engineering, Data Visualization, Matplotlib, Linux, Seaborn","Problem-Solving, Analytical Thinking, Teamwork","Customer Churn Prediction, Predictive Sales Model",Gurgaon,Bangalore,Hyderabad,GEN,IT,No,urban
C1115,Advait,BCA,"JavaScript, MongoDB, React, CSS, Node.js, Kubernetes, Git, Angular","Teamwork, Problem Solving, Adaptability, Creativity, Time Management","Blog Platform, Task Manager App, E-commerce Website, Online Learning Platform",Mumbai,Bangalore,Chennai,OBC,IT,No,urban
C1116,Neha Sinha,B.Tech in Information Technology,"Python, Data Visualization, PowerBI, Cloud, Java","Analytical Thinking, Collaboration, Adaptability","Fraud Detection Model, PowerBI Dashboard",Gurgaon,Bangalore,Hyderabad,GEN,IT,No,urban
C1117,Lokesh Kapoor,B.Com in Finance,"Cash Flow Analysis, Banking Regulations (Basics), Client Documentation, Treasury Operations Basics, Interest Rate Analytics","Attention to Detail, Communication, Time Management","Treasury Cash Flow Report, Corporate Client Presentation",Hyderabad,Mumbai,Jaipur,GEN,Banking & Financial Services,No,urban
C1118,Aman Malhotra,B.Com,"Flutter, iOS, Android, Firebase, React Native, TypeScript, Redis, Python","Adaptability, Collaboration, Work Ethic","E-commerce Mobile App, Library Management System",Bangalore,Hyderabad,Gurgaon,GEN,IT,Yes,urban
C1119,Saanvi,B.Tech CSE,"Node.js, HTML, Python, Docker, TypeScript, Java, SQL","Teamwork, Problem Solving, Communication",Chat Application,Pune,Gurgaon,Chennai,SC,IT,No,urban
C1120,Tanya Reddy,BBA in Business Administration,"Cash Flow Analysis, Treasury Operations Basics, Risk Assessment, Financial Statement Analysis, Tax Compliance","Critical Thinking, Attention to Detail, Leadership","Corporate Client Presentation, Treasury Report Preparation, Tax Compliance Report",Kolkata,Hyderabad,Mumbai,GEN,Banking & Financial Services,No,urban
C1121,Sneha Iyer,B.Sc in Biotechnology,"Chemical Analysis, Problem-Solving, Analytical Techniques (GC), Lab Safety, Chemical Synthesis, Material Testing","Attention to Detail, Critical Thinking, Adaptability, Creativity","Spectroscopy Study, Prototype Formulation, P&ID Design Analysis",Baroda,Chennai,Jamnagar,GEN,Chemical Industry,No,urban
C1122,Gauri Das,BBA in Business Administration,"Risk Assessment, Cash Flow Analysis, Excel, Tax Compliance, Investment Analysis","Communication, Attention to Detail, Ethical Judgment","Treasury Report Preparation, Treasury Cash Flow Report, Investment Portfolio Analysis",Mumbai,Hyderabad,Bangalore,GEN,Banking & Financial Services,No,urban
C1123,Ritika Saxena,B.Tech in Artificial Intelligence,"Python, Data Visualization, EDA, Java, Kubernetes, Cybersecurity","Problem-Solving, Analytical Thinking, Leadership","House Price Prediction, PowerBI Dashboard",Gurgaon,Bangalore,Hyderabad,GEN,IT,Yes,urban
C1124,Meera,B.Tech IT,"JavaScript, CSS, MongoDB, TypeScript, GraphQL, Docker, Java","Teamwork, Communication, Critical Thinking","Task Manager App, Portfolio Website",Hyderabad,Gurgaon,Chennai,SC,IT,Yes,rural
C1125,Sanya Kapoor,B.Sc in Statistics,"PowerBI, Data Visualization, Python, Kubernetes, R","Problem-Solving, Collaboration, Leadership","Customer Churn Prediction, Fraud Detection Model",Bangalore,Hyderabad,Gurgaon,OBC,IT,No,urban
C1126,Aryan,MCA,"JavaScript, HTML, MongoDB, GraphQL, SQL","Communication, Adaptability, Time Management","E-commerce Website, Online Learning Platform",Mumbai,Hyderabad,Pune,OBC,IT,Yes,urban
C1127,Karan Mishra,B.Com in Banking,"Financial Modeling, Banking Regulations (Basics), Treasury Operations Basics, Market Research, Data Analysis","Communication, Critical Thinking, Adaptability","Corporate Client Presentation, Treasury Cash Flow Report",Mumbai,Jaipur,Hyderabad,GEN,Banking & Financial Services,No,urban
C1128,Ananya Ghosh,B.Sc in Industrial Chemistry,"Safety Standards, P&ID Design, Heat & Mass Transfer, Excel, Process Simulation (ChemCAD), Chemical Engineering Fundamentals, Environmental Monitoring","Problem-Solving, Attention to Detail, Collaboration, Critical Thinking","Process Flow Optimization, Energy Balance Optimization, Safety Compliance Review",Hyderabad,Baroda,Jamnagar,GEN,Chemical Industry,No,urban
C1129,Aman Nair,B.Com,"Network Security, Linux, Computer Networks, Data Structures, CSS, JavaScript","Attention to Detail, Teamwork, Communication","Data Encryption Tool, Hospital Management System",Hyderabad,Bangalore,Gurgaon,SC,IT,No,urban
C1130,Kabir Sharma,B.Tech in Mechanical Engineering,"Signal Processing, BMS (Battery Management Systems), Control Systems, IoT, Manufacturing Processes","Critical Thinking, Time Management, Creativity","IoT Sensor Integration, MATLAB Control Model, Vehicle Testing Module",Pune,Bangalore,Noida,GEN,Automotive,No,urban
C1131,Ishita Kapoor,B.Tech in Electronics Engineering,"BMS (Battery Management Systems), IoT, PCB Design, Power Electronics, Energy Storage Systems","Problem-solving, Collaboration, Leadership","Power Electronics Simulation, Thermal Management Study",Ahmedabad,Pune,Noida,OBC,Automotive,No,urban
C1132,Ananya Patel,BBA in Business Administration,"Documentation, Legal Drafting, Audit Procedures, Risk & Compliance Knowledge, Financial Modeling, Risk Assessment","Collaboration, Critical Thinking, Time Management","Audit Compliance Report, Risk Assessment Study",Chennai,Mumbai,Hyderabad,OBC,Banking & Financial Services,No,rural
C1133,Nitin Malhotra,B.Com in Accounting,"Banking Regulations (Basics), Financial Statement Analysis, Excel, Cash Flow Analysis, Interest Rate Analytics","Attention to Detail, Collaboration, Ethical Judgment","Treasury Cash Flow Report, Client Onboarding Documentation",Hyderabad,Jaipur,Mumbai,GEN,Banking & Financial Services,No,urban
